{
  "schema_version": "1.0",
  "revision": {
    "vcs": "git",
    "id": "3f5a1c9e0b7d4a2f8e6c1b0a9d8e7f6a5b4c3d2e",
    "diff_stats": {
      "lines_added": 42,
      "lines_removed": 0
    }
  },
  "attribution_level": "line",
  "recorded_at": "2026-09-25T10:00:00Z",
  "producer": {
    "name": "origin-cli",
    "version": "0.20260924.258"
  },
  "contributions": [
    {
      "evidence": "session_capture",
      "agent": {
        "id": "claude-code"
      },
      "model": {
        "id": "claude-opus-4-6"
      },
      "session": {
        "id": "8b1f3c2e-5d4a-4e6f-9a7b-0c1d2e3f4a5b",
        "reference_uri": "https://origin.example.com/sessions/8b1f3c2e-5d4a-4e6f-9a7b-0c1d2e3f4a5b",
        "prompt_count": 5,
        "iterations": [
          {
            "index": 3,
            "prompt_hash": "sha256:512d6c38f4066df65fc7c9606eee8e56db8f744938c23e1cb473524cb72a6947",
            "reference_uri": "https://origin.example.com/sessions/8b1f3c2e-5d4a-4e6f-9a7b-0c1d2e3f4a5b?prompt=3"
          },
          {
            "index": 4,
            "prompt_hash": "sha256:fe415a6ebb38d75f3ff8685e31a4ae1181db8f304f65cb8647f4f2a4e56257ea",
            "reference_uri": "https://origin.example.com/sessions/8b1f3c2e-5d4a-4e6f-9a7b-0c1d2e3f4a5b?prompt=4"
          }
        ]
      },
      "files": [
        {
          "path": "src/upload/retry.ts",
          "ranges": [
            {
              "start_line": 10,
              "end_line": 42,
              "iteration_index": 3
            },
            {
              "start_line": 50,
              "end_line": 55
            }
          ]
        },
        {
          "path": "src/upload/retry.test.ts",
          "ranges": [
            {
              "start_line": 1,
              "end_line": 1,
              "iteration_index": 4
            }
          ]
        }
      ]
    }
  ]
}
